[
  {
    "id": "assoc:11138:0005180:30d2554e9d85",
    "gene_id": "HGNC:11138",
    "disease_id": "MONDO:0005180",
    "status": "observed_unreviewed",
    "support_tier": "multi_source_observed",
    "evidence_row_ids": [
      "ev:1334c1bebb2461e7",
      "ev:72320abfbe45babd"
    ],
    "source_coverage": {
      "supporting_source_ids": [
        "source:clinvar",
        "source:opentargets"
      ],
      "silent_source_ids": [],
      "conflicting_source_ids": [],
      "source_independence_note": "Multiple supporting sources are present in release evidence coverage."
    },
    "review_state": "ai_reviewed",
    "caveats": [
      "ClinVar gene-condition context has not passed human scientific review.",
      "ClinVar gene-condition context is provenance only; not diagnostic, treatment, or clinical decision-making guidance.",
      "Public-candidate draft; research-use only and not a clinical or manuscript-grade finding."
    ]
  },
  {
    "id": "assoc:14581:0005180:ebb91ace37cc",
    "gene_id": "HGNC:14581",
    "disease_id": "MONDO:0005180",
    "status": "observed_unreviewed",
    "support_tier": "multi_source_observed",
    "evidence_row_ids": [
      "ev:6412fe8fdd0cfaba",
      "ev:6ab9bae0486a9826"
    ],
    "source_coverage": {
      "supporting_source_ids": [
        "source:clinvar",
        "source:opentargets"
      ],
      "silent_source_ids": [],
      "conflicting_source_ids": [],
      "source_independence_note": "Multiple supporting sources are present in release evidence coverage."
    },
    "review_state": "ai_reviewed",
    "caveats": [
      "ClinVar gene-condition context has not passed human scientific review.",
      "ClinVar gene-condition context is provenance only; not diagnostic, treatment, or clinical decision-making guidance.",
      "Public-candidate draft; research-use only and not a clinical or manuscript-grade finding."
    ]
  },
  {
    "id": "assoc:16369:0005180:a7d5f6dafc64",
    "gene_id": "HGNC:16369",
    "disease_id": "MONDO:0005180",
    "status": "observed_unreviewed",
    "support_tier": "multi_source_observed",
    "evidence_row_ids": [
      "ev:1795b3bedf3a73db",
      "ev:1d951d36e127e9d1"
    ],
    "source_coverage": {
      "supporting_source_ids": [
        "source:clinvar",
        "source:opentargets"
      ],
      "silent_source_ids": [],
      "conflicting_source_ids": [],
      "source_independence_note": "Multiple supporting sources are present in release evidence coverage."
    },
    "review_state": "ai_reviewed",
    "caveats": [
      "ClinVar gene-condition context has not passed human scientific review.",
      "ClinVar gene-condition context is provenance only; not diagnostic, treatment, or clinical decision-making guidance.",
      "Public-candidate draft; research-use only and not a clinical or manuscript-grade finding."
    ]
  },
  {
    "id": "assoc:18618:0005180:2c2dffd3b9c0",
    "gene_id": "HGNC:18618",
    "disease_id": "MONDO:0005180",
    "status": "observed_unreviewed",
    "support_tier": "multi_source_observed",
    "evidence_row_ids": [
      "ev:cd0651162e8246c5",
      "ev:f4c44900fffcbdcb"
    ],
    "source_coverage": {
      "supporting_source_ids": [
        "source:clinvar",
        "source:opentargets"
      ],
      "silent_source_ids": [],
      "conflicting_source_ids": [],
      "source_independence_note": "Multiple supporting sources are present in release evidence coverage."
    },
    "review_state": "ai_reviewed",
    "caveats": [
      "ClinVar gene-condition context has not passed human scientific review.",
      "ClinVar gene-condition context is provenance only; not diagnostic, treatment, or clinical decision-making guidance.",
      "Public-candidate draft; research-use only and not a clinical or manuscript-grade finding."
    ]
  },
  {
    "id": "assoc:4177:0005180:cbb5c613d9b7",
    "gene_id": "HGNC:4177",
    "disease_id": "MONDO:0005180",
    "status": "observed_unreviewed",
    "support_tier": "multi_source_observed",
    "evidence_row_ids": [
      "ev:7101825351047148",
      "ev:db5dd7bbbdd79e42"
    ],
    "source_coverage": {
      "supporting_source_ids": [
        "source:clinvar",
        "source:opentargets"
      ],
      "silent_source_ids": [],
      "conflicting_source_ids": [],
      "source_independence_note": "Multiple supporting sources are present in release evidence coverage."
    },
    "review_state": "ai_reviewed",
    "caveats": [
      "ClinVar gene-condition context has not passed human scientific review.",
      "ClinVar gene-condition context is provenance only; not diagnostic, treatment, or clinical decision-making guidance.",
      "Public-candidate draft; research-use only and not a clinical or manuscript-grade finding."
    ]
  },
  {
    "id": "assoc:8607:0005180:291e03b96a5d",
    "gene_id": "HGNC:8607",
    "disease_id": "MONDO:0005180",
    "status": "observed_unreviewed",
    "support_tier": "multi_source_observed",
    "evidence_row_ids": [
      "ev:34d5a83df07baf0f",
      "ev:741c19c06e01ad51"
    ],
    "source_coverage": {
      "supporting_source_ids": [
        "source:clinvar",
        "source:opentargets"
      ],
      "silent_source_ids": [],
      "conflicting_source_ids": [],
      "source_independence_note": "Multiple supporting sources are present in release evidence coverage."
    },
    "review_state": "ai_reviewed",
    "caveats": [
      "ClinVar gene-condition context has not passed human scientific review.",
      "ClinVar gene-condition context is provenance only; not diagnostic, treatment, or clinical decision-making guidance.",
      "Public-candidate draft; research-use only and not a clinical or manuscript-grade finding."
    ]
  }
]
